{
  "evidence_scope": "external_corpus_integration",
  "fixtures": [
    {
      "contract_equal": true,
      "fixture_id": "public-1.4-jpeg-good-ca",
      "input_sha256": "cafc48c53e651f7ba4622d1f72783827074211e42b9634cc863ec3be3c7651b3",
      "license": "CC-BY-SA-4.0",
      "limitation": "The legacy 1.4 asset is external-corpus integration evidence. c2pa-rs performs cryptographic validation; scrub has no pinned trust roots, so valid and bound is not promoted to trusted.",
      "scrub_binding_status": "present",
      "scrub_parse_status": "present",
      "scrub_trust_status": "unknown",
      "scrub_validation_status": "present",
      "unsupported_state": null,
      "upstream_category": "good / one parent ingredient",
      "upstream_commit": "22beccc075707475b038d8789d0136c009e43143",
      "upstream_path": "legacy/1.4/image/jpeg/adobe-20220124-CA.jpg",
      "upstream_repo": "https://github.com/c2pa-org/public-testfiles",
      "upstream_sha256": "cafc48c53e651f7ba4622d1f72783827074211e42b9634cc863ec3be3c7651b3",
      "upstream_spec_corpus_version": "C2PA 1.4 (legacy/1.4)"
    },
    {
      "contract_equal": true,
      "fixture_id": "public-1.4-jpeg-bad-data-hash",
      "input_sha256": "dae9d121060cec4b6f27ee8acda85ad461cf75f2261d90b463319b787342d7f9",
      "license": "CC-BY-SA-4.0",
      "limitation": "A parsed manifest store is not a valid or bound claim. The result is c2pa-rs integration and scrub semantic-mapping evidence, not independent cryptographic validation.",
      "scrub_binding_status": "invalid",
      "scrub_parse_status": "present",
      "scrub_trust_status": "not_applicable",
      "scrub_validation_status": "invalid",
      "unsupported_state": null,
      "upstream_category": "bad / hard-binding hash mismatch",
      "upstream_commit": "22beccc075707475b038d8789d0136c009e43143",
      "upstream_path": "legacy/1.4/image/jpeg/adobe-20220124-E-dat-CA.jpg",
      "upstream_repo": "https://github.com/c2pa-org/public-testfiles",
      "upstream_sha256": "dae9d121060cec4b6f27ee8acda85ad461cf75f2261d90b463319b787342d7f9",
      "upstream_spec_corpus_version": "C2PA 1.4 (legacy/1.4)"
    },
    {
      "contract_equal": true,
      "fixture_id": "public-1.4-jpeg-bad-signature",
      "input_sha256": "0d4c2774f1b7e94b9613bb952b0a76b6a178d22ac6d206d257d2af1376cbbff2",
      "license": "CC-BY-SA-4.0",
      "limitation": "scrub does not run phase-two validation without a reproducible time basis. UNKNOWN preserves that prerequisite boundary and is not acceptance of the upstream bad signature.",
      "scrub_binding_status": "unknown",
      "scrub_parse_status": "present",
      "scrub_trust_status": "not_applicable",
      "scrub_validation_status": "unknown",
      "unsupported_state": null,
      "upstream_category": "bad / signature did not validate",
      "upstream_commit": "22beccc075707475b038d8789d0136c009e43143",
      "upstream_path": "legacy/1.4/image/jpeg/adobe-20220124-E-sig-CA.jpg",
      "upstream_repo": "https://github.com/c2pa-org/public-testfiles",
      "upstream_sha256": "0d4c2774f1b7e94b9613bb952b0a76b6a178d22ac6d206d257d2af1376cbbff2",
      "upstream_spec_corpus_version": "C2PA 1.4 (legacy/1.4)"
    },
    {
      "contract_equal": true,
      "fixture_id": "public-1.4-jpeg-bad-referenced-claim",
      "input_sha256": "b3ff3f00c66602280977d3e4d962a836d33ab83953d0009f7c1e6490d0065feb",
      "license": "CC-BY-SA-4.0",
      "limitation": "scrub preserves structural presence while refusing phase-two conclusions without its reproducibility prerequisites. UNKNOWN is not a valid, bound, or trusted result.",
      "scrub_binding_status": "unknown",
      "scrub_parse_status": "present",
      "scrub_trust_status": "not_applicable",
      "scrub_validation_status": "unknown",
      "unsupported_state": null,
      "upstream_category": "bad / referenced claim missing",
      "upstream_commit": "22beccc075707475b038d8789d0136c009e43143",
      "upstream_path": "legacy/1.4/image/jpeg/adobe-20220124-E-clm-CAICAI.jpg",
      "upstream_repo": "https://github.com/c2pa-org/public-testfiles",
      "upstream_sha256": "b3ff3f00c66602280977d3e4d962a836d33ab83953d0009f7c1e6490d0065feb",
      "upstream_spec_corpus_version": "C2PA 1.4 (legacy/1.4)"
    }
  ],
  "schema_version": "0.1",
  "scrub": {
    "c2pa_dependency": "c2pa-rs 0.90.12",
    "replay_command": [
      "python",
      "tools/c2pa_replay.py",
      "--check"
    ],
    "version": "0.1.0"
  },
  "source": {
    "integration": "vendored representative subset",
    "license": "CC-BY-SA-4.0",
    "upstream_commit": "22beccc075707475b038d8789d0136c009e43143",
    "upstream_repo": "https://github.com/c2pa-org/public-testfiles",
    "upstream_spec_corpus_version": "C2PA 1.4 (legacy/1.4)"
  }
}
